{
    "$schema": "https://repometric.github.io/linterhub/schema/meta.json",
    "name": "prettier",
    "description": "Prettier is an opinionated code formatter. It enforces a consistent style by parsing your code and re-printing it with its own rules that take the maximum line length into account, wrapping code when necessary.",
    "url": "https://github.com/prettier/prettier",
    "languages": [
        "JavaScript",
        "TypeScript",
        "CSS",
        "SCSS",
        "Less", 
        "JSX",
        "Vue",
        "GraphQL",
        "JSON",
        "Markdown"
    ],
    "configs": [
        ".prettierrc",
        "prettier.config.js"
    ],
    "license": "MIT"
}
