{
    "$schema": "https://repometric.github.io/linterhub/schema/meta.json",
    "name": "ocstyle",
    "description": "OCStyle is a Objective-C style checker",
    "url": "https://github.com/Cue/ocstyle",
    "languages": [
        "Python",
        "Objective-C"
    ],
    "license": "Apache-2.0"
}
